id,category,question,answer,refused,latency_seconds,keyword_hit_rate,citation_ok,refusal_correct,error
J1,answerable,List two signature juices mentioned in the Joe & the Juice menu.,"Two signature juices mentioned in the Joe & the Juice menu are:

1. Feel Good (Carrot, Turmeric, Ginger, Lemon, Apple, Olive Oil, Ice) - £9.00 (Source: Joe & the Juice.pdf, p.0)
2. Herb Tonic (Turmeric, Ginger, Pineapple, Black Pepper, Apple, Olive Oil, Ice) - £9.00 (Source: Joe & the Juice.pdf, p.0)",False,7.963,0.5,True,True,
J2,answerable,What ingredients are listed for the 'Feel Good' juice?,"No relevant content found in your uploads for that question. Try rephrasing or upload a more specific document.
Tip: Try asking about a specific section, item name, or include a keyword from the document.",True,2.4,0.0,True,False,
I1,answerable,Who is the Module and Course Leader for the IoT lecture?,"The Module and Course Leader for the IoT lecture is Stavros Dimitriou (Source: 01 Introduction to IoT.pdf, p.0).",False,2.631,1.0,True,True,
I2,answerable,"How many devices are connected on the Internet by 2023, according to the IoT lecture?","I counted 16 item lines in the retrieved menu text.

Note: This count is based on the retrieved sections and may be incomplete if the PDF is partial.
Tip: For a precise count, ask per category (e.g., 'How many Sandwiches are listed?')",False,0.5,0.0,True,True,
R1,should_refuse,What year was Joe & the Juice founded?,I could not find this information in the uploaded PDFs.,True,2.746,0.0,True,True,
R2,should_refuse,What is the capital of France?,I could not find this information in the uploaded PDFs.,True,2.46,0.0,True,True,
